{
  "schema_version": "lathe.scene_manifest.v1",
  "scene_id": "underwater_train_station",
  "scene_version": 1,
  "mode": "preview",
  "status": "golden_fixture_proxy_contract",
  "offline": true,
  "source": {
    "prompt": "../prompt.txt",
    "dream_brief": "../dream_brief.json",
    "scene_graph": "../scene_graph.json",
    "world_memory": "../world_memory.json"
  },
  "objects": [
    {
      "object_id": "obj_glass_tube_concourse_001",
      "source": "glass_tube_concourse",
      "status": "planned",
      "artifact_dir": "build/objects/obj_glass_tube_concourse_001"
    },
    {
      "object_id": "obj_stopped_bathysphere_train_002",
      "source": "stopped_bathysphere_train",
      "status": "planned",
      "artifact_dir": "build/objects/obj_stopped_bathysphere_train_002"
    },
    {
      "object_id": "obj_platform_edge_markers_003",
      "source": "platform_edge_markers",
      "status": "planned",
      "artifact_dir": "build/objects/obj_platform_edge_markers_003"
    },
    {
      "object_id": "obj_red_signal_lamps_004",
      "source": "red_signal_lamps",
      "status": "planned",
      "artifact_dir": "build/objects/obj_red_signal_lamps_004"
    },
    {
      "object_id": "obj_sealed_service_hatch_005",
      "source": "sealed_service_hatch",
      "status": "planned",
      "artifact_dir": "build/objects/obj_sealed_service_hatch_005"
    },
    {
      "object_id": "obj_coral_platform_growth_006",
      "source": "coral_platform_growth",
      "status": "planned",
      "artifact_dir": "build/objects/obj_coral_platform_growth_006"
    }
  ],
  "planned_renders": [
    {
      "task_id": "render_task_camera_debug_topdown_bc8a62809e",
      "camera_id": "camera_debug_topdown",
      "status": "planned",
      "passes": [
        "beauty",
        "object_id"
      ],
      "artifact_path": null
    },
    {
      "task_id": "render_task_camera_hatch_detail_c80e3ced13",
      "camera_id": "camera_hatch_detail",
      "status": "planned",
      "passes": [
        "beauty",
        "object_id"
      ],
      "artifact_path": null
    },
    {
      "task_id": "render_task_camera_reveal_3b7c5655ea",
      "camera_id": "camera_reveal",
      "status": "planned",
      "passes": [
        "beauty",
        "object_id"
      ],
      "artifact_path": null
    }
  ],
  "planned_exports": [
    {
      "task_id": "export_task_glb_glb_9c8ae86066",
      "target": "glb",
      "format": "glb",
      "declared_path": "dist/exports/underwater_train_station.glb",
      "status": "planned",
      "artifact_path": null
    },
    {
      "task_id": "export_task_scene_graph_json_cf2b39fbd3",
      "target": "scene_graph",
      "format": "json",
      "declared_path": "scene_graph.json",
      "status": "planned",
      "artifact_path": null
    },
    {
      "task_id": "export_task_scene_package_lathepkg_46f332ee12",
      "target": "scene_package",
      "format": "lathepkg",
      "declared_path": "dist/underwater_train_station.lathepkg",
      "status": "planned",
      "artifact_path": null
    }
  ],
  "built_renders": [],
  "built_exports": [],
  "notes": [
    "Golden fixture reports deterministic proxy readiness only.",
    "Generated render/export artifacts are produced in .tmp_tests during evidence runs, not committed here."
  ]
}
