{
  "schema_version": "lathe.scene_manifest.v1",
  "scene_id": "abandoned_roblox_mall",
  "scene_version": 1,
  "mode": "preview",
  "status": "golden_fixture_proxy_contract",
  "offline": true,
  "source": {
    "prompt": "../prompt.txt",
    "dream_brief": "../dream_brief.json",
    "scene_graph": "../scene_graph.json",
    "world_memory": "../world_memory.json"
  },
  "objects": [
    {
      "object_id": "obj_storefront_row_001",
      "source": "storefront_row",
      "status": "planned",
      "artifact_dir": "build/objects/obj_storefront_row_001"
    },
    {
      "object_id": "obj_fountain_planter_001",
      "source": "dry_fountain_planter",
      "status": "planned",
      "artifact_dir": "build/objects/obj_fountain_planter_001"
    },
    {
      "object_id": "obj_broken_escalator_001",
      "source": "broken_escalator_rail",
      "status": "planned",
      "artifact_dir": "build/objects/obj_broken_escalator_001"
    },
    {
      "object_id": "obj_security_gate_001",
      "source": "arcade_security_gate",
      "status": "planned",
      "artifact_dir": "build/objects/obj_security_gate_001"
    }
  ],
  "planned_renders": [
    {
      "task_id": "render_task_camera_gate_detail_054067a844",
      "camera_id": "camera_gate_detail",
      "status": "planned",
      "passes": [
        "beauty",
        "object_id"
      ],
      "artifact_path": null
    },
    {
      "task_id": "render_task_camera_reveal_3b7c5655ea",
      "camera_id": "camera_reveal",
      "status": "planned",
      "passes": [
        "beauty",
        "object_id"
      ],
      "artifact_path": null
    },
    {
      "task_id": "render_task_camera_topdown_debug_5f9f6a13a1",
      "camera_id": "camera_topdown_debug",
      "status": "planned",
      "passes": [
        "beauty",
        "object_id"
      ],
      "artifact_path": null
    }
  ],
  "planned_exports": [
    {
      "task_id": "export_task_roblox_manifest_json_9345acd627",
      "target": "roblox_manifest",
      "format": "json",
      "declared_path": "dist/exports/abandoned_roblox_mall.roblox_manifest.json",
      "status": "planned",
      "artifact_path": null
    },
    {
      "task_id": "export_task_scene_graph_json_cf2b39fbd3",
      "target": "scene_graph",
      "format": "json",
      "declared_path": "scene_graph.json",
      "status": "planned",
      "artifact_path": null
    },
    {
      "task_id": "export_task_scene_package_lathepkg_2e2d047c10",
      "target": "scene_package",
      "format": "lathepkg",
      "declared_path": "dist/abandoned_roblox_mall.lathepkg",
      "status": "planned",
      "artifact_path": null
    }
  ],
  "built_renders": [],
  "built_exports": [],
  "notes": [
    "Golden fixture reports deterministic proxy readiness only.",
    "Generated render/export artifacts are produced in .tmp_tests during evidence runs, not committed here."
  ]
}
